beam_id,title,category_main_group,category_sub_group,category,categories,address,street,city,state,borough,neighborhood,postal_code,country,address_verified,latitude,longitude,timezone,phone,price_level,business_status,has_open_hours,has_price,census_place,verified_census_city,beam_location_name,beam_state_code,beam_country_code,website_protocol,website,website_normalized,website_domain,website_domain_tld,website_domain_age,website_domain_registered,website_domain_expires,website_domain_registrar,emails_list,emails_list_website_domain,emails_count,emails_deliverable_count,emails_risky_count,description,has_about,has_description,rating,reviews_total_count,reviews_per_rating,service_options,highlights,popular_for,accessibility,offerings,dining_options,amenities,atmosphere,crowd,planning,payments,children,has_popular_times,has_website,has_email,has_social,has_phone,socials_count,first_social_post_date,last_social_post_date,first_social_post_days,last_social_post_days,social_post_count,first_social_post_days_min,first_social_post_days_max,last_social_post_days_min,last_social_post_days_max,social_profile_instagram,social_username_instagram,social_profile_facebook,social_username_facebook,social_profile_twitter,social_username_twitter,social_profile_tiktok,social_username_tiktok,social_profile_linkedin,social_username_linkedin,social_profile_youtube,social_username_youtube,social_profile_github,social_username_github,social_profile_snapchat,social_username_snapchat,social_profile_pinterest,social_username_pinterest,instagram_followers,instagram_engagement_rate,instagram_engagement_rate_1m,instagram_engagement_rate_3m,instagram_engagement_rate_6m,instagram_engagement_rate_12m,instagram_post_count,tiktok_followers,tiktok_video_count,tiktok_heart_count,tiktok_engagement_rate,tiktok_engagement_rate_1m,tiktok_engagement_rate_3m,tiktok_engagement_rate_6m,tiktok_engagement_rate_12m,menu_link,order_links,reservation_link,last_updated_at,beam_cross_social_market_penetration,beam_cross_velocity_quality,beam_cross_social_urgency,beam_cross_per_capita_engagement,beam_cross_market_saturation_lead,beam_cross_population_adjusted_rank,beam_cross_demand_gap_index,beam_rating_score,beam_review_confidence,beam_rating_health,sentiment_avg,sentiment_avg_30d,sentiment_avg_90d,sentiment_avg_180d,sentiment_avg_360d,sentiment_percentile_1km,sentiment_percentile_5km,sentiment_percentile_10km,sentiment_score_90d,sentiment_score_360d,sentiment_positive_pct_30d,sentiment_negative_pct_30d,sentiment_neutral_pct_30d,sentiment_positive_pct_90d,sentiment_negative_pct_90d,sentiment_neutral_pct_90d,sentiment_positive_pct_180d,sentiment_negative_pct_180d,sentiment_neutral_pct_180d,sentiment_positive_pct_360d,sentiment_negative_pct_360d,sentiment_neutral_pct_360d,sentiment_trend_30vs90d,sentiment_trend_90vs360d,sentiment_diff_30vs90d,sentiment_change_360d,sentiment_diff_90vs360d,sentiment_change_pct_360d,reviews_count_30d,reviews_count_90d,reviews_count_180d,reviews_count_360d,review_growth_pct_180d,review_growth_pct_360d,review_growth_pct_90d,beam_score_overall,beam_popularity_percentile,beam_social_presence,beam_data_completeness,beam_price_value,beam_data_freshness,beam_rank_city_category,beam_rank_city_overall,beam_rank_city_reviews,beam_rank_state_category,beam_rank_state_overall,beam_rank_state_reviews,beam_rank_country_category,beam_rank_country_overall,beam_rank_country_reviews,beam_rank_place_global_category,beam_rank_category,beam_rank_competition_1km_category,beam_rank_competition_1km_total,beam_rank_competition_1km_reviews,beam_rank_competition_5km_category,beam_rank_competition_5km_total,beam_rank_competition_5km_reviews,beam_rank_competition_10km_category,beam_rank_competition_10km_total,beam_rank_competition_10km_reviews,beam_export_rank,total_city_category,total_city,total_state_category,total_state,total_country_category,total_country,total_category_global,beam_competitors_10km_competitive_strength,beam_competitors_10km_competitor_avg_sentiment_30d,beam_competitors_10km_competitor_avg_sentiment_90d,beam_competitors_10km_sentiment_diff_30d,beam_competitors_10km_sentiment_diff_90d,beam_competitors_1km_competitive_strength,beam_competitors_1km_competitor_avg_sentiment_30d,beam_competitors_1km_competitor_avg_sentiment_90d,beam_competitors_1km_sentiment_diff_30d,beam_competitors_1km_sentiment_diff_90d,beam_competitors_5km_competitive_strength,beam_competitors_5km_competitor_avg_sentiment_30d,beam_competitors_5km_competitor_avg_sentiment_90d,beam_competitors_5km_sentiment_diff_30d,beam_competitors_5km_sentiment_diff_90d,beam_competitors_10km_competitor_count,beam_competitors_1km_competitor_count,beam_competitors_5km_competitor_count,beam_competitors_1km_rank_by_score,beam_competitors_1km_rank_by_rating,beam_competitors_1km_rank_by_reviews,beam_competitors_1km_score_percentile,beam_competitors_1km_rating_percentile,beam_competitors_1km_reviews_percentile,beam_competitors_1km_health_percentile,beam_competitors_1km_sentiment_percentile,beam_competitors_1km_competitor_avg_score,beam_competitors_1km_competitor_avg_rating,beam_competitors_1km_competitor_avg_reviews,beam_competitors_1km_competitor_avg_health,beam_competitors_1km_competitor_avg_sentiment,beam_competitors_1km_score_diff,beam_competitors_1km_rating_diff,beam_competitors_1km_reviews_diff,beam_competitors_1km_health_diff,beam_competitors_1km_sentiment_diff,beam_competitors_5km_rank_by_score,beam_competitors_5km_rank_by_rating,beam_competitors_5km_rank_by_reviews,beam_competitors_5km_score_percentile,beam_competitors_5km_rating_percentile,beam_competitors_5km_reviews_percentile,beam_competitors_5km_health_percentile,beam_competitors_5km_sentiment_percentile,beam_competitors_5km_competitor_avg_score,beam_competitors_5km_competitor_avg_rating,beam_competitors_5km_competitor_avg_reviews,beam_competitors_5km_competitor_avg_health,beam_competitors_5km_competitor_avg_sentiment,beam_competitors_5km_score_diff,beam_competitors_5km_rating_diff,beam_competitors_5km_reviews_diff,beam_competitors_5km_health_diff,beam_competitors_5km_sentiment_diff,beam_competitors_10km_rank_by_score,beam_competitors_10km_rank_by_rating,beam_competitors_10km_rank_by_reviews,beam_competitors_10km_score_percentile,beam_competitors_1km_competitive_tier,beam_competitors_10km_rating_percentile,beam_competitors_10km_reviews_percentile,beam_competitors_10km_health_percentile,beam_competitors_10km_sentiment_percentile,beam_competitors_5km_competitive_tier,beam_competitors_10km_competitor_avg_score,beam_competitors_10km_competitor_avg_rating,beam_competitors_10km_competitor_avg_reviews,beam_competitors_10km_competitor_avg_health,beam_competitors_10km_competitive_tier,beam_competitors_10km_competitor_avg_sentiment,beam_competitors_10km_score_diff,beam_competitors_10km_rating_diff,beam_competitors_10km_reviews_diff,beam_competitors_10km_health_diff,beam_competitors_10km_sentiment_diff,beam_competitors_1km_total_in_radius,beam_competitors_5km_total_in_radius,beam_competitors_10km_total_in_radius,beam_competitors_1km_avg_distance_m,beam_competitors_1km_closest_competitor_m,beam_competitors_1km_market_type,beam_competitors_1km_review_share,beam_competitors_1km_density_per_sqkm,beam_competitors_1km_tier_below_40,beam_competitors_1km_tier_40_59,beam_competitors_1km_tier_60_79,beam_competitors_1km_tier_80_100,beam_competitors_5km_avg_distance_m,beam_competitors_5km_closest_competitor_m,beam_competitors_5km_market_type,beam_competitors_5km_review_share,beam_competitors_5km_density_per_sqkm,beam_competitors_5km_tier_below_40,beam_competitors_5km_tier_40_59,beam_competitors_5km_tier_60_79,beam_competitors_5km_tier_80_100,beam_competitors_10km_avg_distance_m,beam_competitors_10km_closest_competitor_m,beam_competitors_10km_market_type,beam_competitors_10km_review_share,beam_competitors_10km_density_per_sqkm,beam_competitors_10km_tier_below_40,beam_competitors_10km_tier_40_59,beam_competitors_10km_tier_60_79,beam_competitors_10km_tier_80_100,beam_competitors_city_competitor_avg_sentiment_30d,beam_competitors_city_competitor_avg_sentiment_90d,beam_competitors_city_sentiment_diff_30d,beam_competitors_city_sentiment_diff_90d,beam_competitors_city_competitor_count,beam_competitors_city_total_in_city,beam_competitors_city_rank_by_score,beam_competitors_city_rank_by_rating,beam_competitors_city_rank_by_reviews,beam_competitors_city_score_percentile,beam_competitors_city_rating_percentile,beam_competitors_city_reviews_percentile,beam_competitors_city_health_percentile,beam_competitors_city_sentiment_percentile,beam_competitors_city_competitor_avg_score,beam_competitors_city_competitor_avg_rating,beam_competitors_city_competitor_avg_reviews,beam_competitors_city_competitor_avg_health,beam_competitors_city_competitor_avg_sentiment,beam_competitors_city_score_diff,beam_competitors_city_rating_diff,beam_competitors_city_reviews_diff,beam_competitors_city_health_diff,beam_competitors_city_sentiment_diff,beam_competitors_city_market_type,beam_competitors_city_review_share,beam_competitors_city_density_per_sqkm,beam_competitors_city_tier_below_40,beam_competitors_city_tier_40_59,beam_competitors_city_tier_60_79,beam_competitors_city_tier_80_100,beam_competitors_city_competitive_strength,beam_competitors_city_underserved_score,beam_competitors_city_competition_intensity,beam_competitors_state_competitor_avg_sentiment_30d,beam_competitors_state_competitor_avg_sentiment_90d,beam_competitors_state_sentiment_diff_30d,beam_competitors_state_sentiment_diff_90d,beam_competitors_state_competitor_count,beam_competitors_state_total_in_state,beam_competitors_state_rank_by_score,beam_competitors_state_rank_by_rating,beam_competitors_state_rank_by_reviews,beam_competitors_state_score_percentile,beam_competitors_state_rating_percentile,beam_competitors_state_reviews_percentile,beam_competitors_state_health_percentile,beam_competitors_state_sentiment_percentile,beam_competitors_state_competitor_avg_score,beam_competitors_state_competitor_avg_rating,beam_competitors_state_competitor_avg_reviews,beam_competitors_state_competitor_avg_health,beam_competitors_state_competitor_avg_sentiment,beam_competitors_state_score_diff,beam_competitors_state_rating_diff,beam_competitors_state_reviews_diff,beam_competitors_state_health_diff,beam_competitors_state_sentiment_diff,beam_competitors_state_market_type,beam_competitors_state_review_share,beam_competitors_state_density_per_sqkm,beam_competitors_state_underserved_score,beam_competitors_state_competition_intensity,beam_competitors_state_competitive_strength,beam_competitors_country_competitor_avg_sentiment_30d,beam_competitors_country_competitor_avg_sentiment_90d,beam_competitors_country_sentiment_diff_30d,beam_competitors_country_sentiment_diff_90d,beam_competitors_country_competitor_count,beam_competitors_country_competitor_avg_score,beam_competitors_country_competitor_avg_rating,beam_competitors_country_competitor_avg_reviews,beam_competitors_country_competitor_avg_health,beam_competitors_country_competitor_avg_sentiment,beam_competitors_country_score_diff,beam_competitors_country_rating_diff,beam_competitors_country_reviews_diff,beam_competitors_country_sentiment_diff,beam_competitors_country_score_percentile,beam_competitors_country_rating_percentile,beam_competitors_country_reviews_percentile,beam_competitors_country_health_percentile,beam_competitors_country_sentiment_percentile,beam_competitors_country_rank_by_score,beam_competitors_country_competitive_strength,beam_competitors_country_health_diff,beam_competitors_country_rank_by_rating,beam_competitors_country_rank_by_reviews,beam_competitors_country_tier_40_59,beam_competitors_country_tier_60_79,beam_competitors_country_tier_80_100,beam_competitors_country_tier_below_40,beam_competitors_country_total_in_country,beam_competitors_city_siblings_competitor_count,beam_competitors_city_siblings_competitor_avg_score,beam_competitors_city_siblings_competitor_avg_rating,beam_competitors_city_siblings_competitor_avg_reviews,beam_competitors_city_siblings_competitor_avg_health,beam_competitors_city_siblings_competitor_avg_sentiment,beam_competitors_city_siblings_score_diff,beam_competitors_city_siblings_rating_diff,beam_competitors_city_siblings_reviews_diff,beam_competitors_city_siblings_sentiment_diff,beam_competitors_city_siblings_score_percentile,beam_competitors_city_siblings_rating_percentile,beam_competitors_city_siblings_reviews_percentile,beam_competitors_city_siblings_health_percentile,beam_competitors_city_siblings_sentiment_percentile,beam_competitors_city_siblings_rank_by_score,beam_competitors_city_siblings_competitor_avg_recommend_pct,beam_competitors_city_siblings_recommend_pct_diff,beam_competitors_city_siblings_recommend_pct_percentile,beam_competitors_city_siblings_total_siblings,beam_competitors_city_businesses_per_10k_pop,beam_competitors_city_population_per_business,beam_competitors_city_population_density,beam_competitors_city_reviews_per_capita,beam_competitors_city_reviews_per_10k_pop,beam_competitors_state_businesses_per_10k_pop,beam_competitors_state_population_per_business,beam_competitors_state_population_density,beam_competitors_state_reviews_per_capita,beam_competitors_state_reviews_per_10k_pop,beam_competitors_1km_hhi_contribution,beam_competitors_1km_hhi_minimum,beam_competitors_5km_hhi_contribution,beam_competitors_5km_hhi_minimum,beam_competitors_10km_hhi_contribution,beam_competitors_10km_hhi_minimum,beam_competitors_city_hhi_contribution,beam_competitors_city_hhi_minimum,beam_competitors_state_hhi_contribution,beam_competitors_state_hhi_minimum,beam_trends_score_30d_beam_score_overall,beam_trends_score_30d_rating,beam_trends_score_30d_review_count,beam_trends_score_30d_beam_rating_health,beam_trends_score_30d_beam_popularity_percentile,beam_trends_score_90d_beam_score_overall,beam_trends_score_90d_rating,beam_trends_score_90d_review_count,beam_trends_score_90d_beam_rating_health,beam_trends_score_90d_beam_popularity_percentile,beam_trends_competitive_1km_30d_strength_change,beam_trends_competitive_1km_30d_rank_change,beam_trends_competitive_1km_30d_percentile_change,beam_trends_competitive_1km_90d_strength_change,beam_trends_competitive_1km_90d_rank_change,beam_trends_competitive_1km_90d_percentile_change,beam_trends_competitive_5km_30d_strength_change,beam_trends_competitive_5km_30d_rank_change,beam_trends_competitive_5km_30d_percentile_change,beam_trends_competitive_5km_90d_strength_change,beam_trends_competitive_5km_90d_rank_change,beam_trends_competitive_5km_90d_percentile_change,beam_trends_competitive_10km_30d_strength_change,beam_trends_competitive_10km_30d_rank_change,beam_trends_competitive_10km_30d_percentile_change,beam_trends_competitive_10km_90d_strength_change,beam_trends_competitive_10km_90d_rank_change,beam_trends_competitive_10km_90d_percentile_change,beam_trends_competitive_city_30d_strength_change,beam_trends_competitive_city_30d_rank_change,beam_trends_competitive_city_30d_percentile_change,beam_trends_competitive_city_90d_strength_change,beam_trends_competitive_city_90d_rank_change,beam_trends_competitive_city_90d_percentile_change,beam_trends_competitive_state_30d_strength_change,beam_trends_competitive_state_30d_rank_change,beam_trends_competitive_state_30d_percentile_change,beam_trends_competitive_state_90d_strength_change,beam_trends_competitive_state_90d_rank_change,beam_trends_competitive_state_90d_percentile_change,beam_trends_sentiment_current_sentiment,beam_trends_sentiment_positive_ratio,beam_trends_sentiment_negative_ratio,beam_trends_sentiment_review_count,beam_trends_velocity_reviews_per_day,beam_trends_velocity_reviews_per_month,beam_trends_velocity_percentile_city,beam_trends_velocity_percentile_state,beam_trends_velocity_trend,beam_velocity_reviews_per_day,beam_velocity_reviews_per_week,beam_velocity_reviews_per_month,beam_velocity_reviews_last_30d,beam_velocity_reviews_last_90d,beam_velocity_reviews_last_365d,beam_velocity_percentile_1km,beam_velocity_percentile_5km,beam_velocity_percentile_10km,beam_velocity_percentile_city,beam_velocity_percentile_state,beam_velocity_rank_1km,beam_velocity_rank_5km,beam_velocity_rank_10km,beam_velocity_rank_city,beam_velocity_rank_state,beam_velocity_trend,beam_velocity_change_30d,beam_velocity_change_90d,beam_trends_sentiment_recommend_pct
6JY7HGHE,Fire Wings,Food and Drink,Restaurants,Chicken wings restaurant,"Chicken wings restaurant, Chicken restaurant, Restaurant, Sports bar","1446 Hulsey Way, Manteca, CA 95336",1446 Hulsey Way,Manteca,California,,,95336,US,True,37.7963923,-121.1929174,America/Los_Angeles,(209) 32*-****,1,,TRUE,TRUE,,True,Manteca,California,US,http,http://firewings.com,firewings.com,firewings.com,com,7996,2004-05-25,2026-05-25,"GoDaddy.com, LLC",,,0,0,0,,TRUE,FALSE,4.2,0,"{""1"": 21, ""2"": 18, ""3"": 28, ""4"": 70, ""5"": 178}","Delivery, Onsite services, Takeout, Dine-in",Fast service,"Lunch, Dinner, Solo dining","Wheelchair accessible entrance, Wheelchair accessible parking lot, Wheelchair accessible restroom, Wheelchair accessible seating","Alcohol, Beer, Comfort food, Quick bite, Small plates","Lunch, Dinner, Catering, Counter service, Seating",Restroom,"Casual, Trendy","College students, Family-friendly, Groups, Tourists",,"Credit cards, Debit cards, NFC mobile payments","Good for kids, High chairs, Kids' menu",TRUE,TRUE,purchase_dataset@,FALSE,TRUE,0,,,,,,,,,,,,,,,,,,,,,,,,,,,,,,,,,,,,,,,,,,,https://firewings.com/manteca-ca-95336,,,2026-04-11T13:13:13.335136+00:00,,,,,,,,0.0,0.0,50.0,0.5022,,0.771,0.4428,0.1957,,,,88.5,59.8,,,,100.0,0.0,0.0,75.0,25.0,0.0,63.64,36.36,0.0,stable,improving,,28.7,0.5753,48.0,0,1,4,11,-50.0,-63.6,-100.0,27.7,19.5,0,50,50.0,96.0,157,253,253,82353,153824,153824,676964,1382364,1382364,730495,157,,,,,,,,,,152,163,260,89056,166785,735647,1464979,735647,,,,,,,,,,,,,,,,,,,,,,,,,,,,,,,,,,,,,,,,,,,,,,,,,,,,,,,,,,,,,,,,,,,,,,,,,,,,,,,,,,,,,,,,,,,,,,,,,,,,,,,,,,,,,,,,,,,,,,,,,,,,,,,,,,,,,,,,,,,,,,,,,,,,,,,,,,,,,,,,,,,,,,,,,,,,,,,,,,,,,,,,,,,,,,,,,,,,,,,43,59.8,3.89,487,68.5,0.3693,-32.1,,-487,-0.3693,0.0476,0.9286,0.0,0.119,0.0476,41,68.08,-68.08,0.0,43,,,,,,,,,,,,,,,,,,,,,0.0,,0,0.0,0.0,,,,,,,,,,,,,,,,,,,,,,,,,,,,,,,,,,,,,,,,,,,,,,,,,,,,,,,,,,,,,,,,
PE76A9FG,Fagundes Meats & Catering Inc,Food and Drink,Restaurants,Butcher shop deli,"Butcher shop deli, Caterer, Mobile caterer","142 Jason St, Manteca, CA 95336",142 Jason St,Manteca,California,,,95336,US,True,37.8098512,-121.2161732,America/Los_Angeles,(209) 23*-****,0,OPERATIONAL,TRUE,FALSE,,True,Manteca,California,US,http,http://fagundescatering.com,fagundescatering.com,fagundescatering.com,com,6740,2007-11-02,2026-11-02,"GoDaddy.com, LLC",,,0,0,0,"Butcher shop offering chops, barbecue, deli items & its own spice mix in an old-school setting.",TRUE,TRUE,4.7,0,"{""1"": 13, ""2"": 6, ""3"": 14, ""4"": 69, ""5"": 446}","Curbside pickup, Delivery, In-store pickup, In-store shopping, Onsite services",,,"Wheelchair accessible entrance, Wheelchair accessible parking lot",,,,,,Quick visit,"Credit cards, Debit cards, NFC mobile payments, SNAP/EBT",,TRUE,TRUE,purchase_dataset@,FALSE,TRUE,0,,,,,,,,,,,,,,,,,,,,,,,,,,,,,,,,,,,,,,,,,,,,,,2026-04-11T00:19:26.902823+00:00,,,,,,,,0.0,0.0,50.0,0.8546,1.0,1.0,0.9843,0.7937,,,,100.0,89.7,100.0,0.0,0.0,100.0,0.0,0.0,100.0,0.0,0.0,90.0,10.0,0.0,stable,improving,0.0,10.3,0.2063,11.5,3,3,8,20,-25.0,-40.0,200.0,27.7,19.5,0,67,50.0,62.0,160,265,265,86619,164942,164942,714877,1495952,1495952,771331,160,,,,,,,,,,152,163,260,89056,166785,735647,1464979,735647,,,,,,,,,,,,,,,,,,,,,,,,,,,,,,,,,,,,,,,,,,,,,,,,,,,,,,,,,,,,,,,,,,,,,,,,,,,,,,,,,,,,,,,,,,,,,,,,,,,,,,,,,,,,,,,,,,,,,,,,,,,,,,,,,,,,,,,,,,,,,,,,,,,,,,,,,,,,,,,,,,,,,,,,,,,,,,,,,,,,,,,,,,,,,,,,,,,,,,,121,62.6,4.09,364,74.9,0.473,-34.9,,-364,-0.473,0.0417,0.9583,0.0,0.0417,0.0333,116,71.52,-71.52,0.0,121,,,,,,,,,,,,,,,,,,,,,0.0,,0,0.0,0.0,,,,,,,,,,,,,,,,,,,,,,,,,,,,,,,,,,,,,,,,,,,,,,,,,,,,,,,,,,,,,,,,
HJ5UW59K,Espresso Subito,Food and Drink,Restaurants,Mobile caterer,"Mobile caterer, Caterer, Coffee roastery, Coffee store, Corporate office, Service establishment, Superfund site",,,Manteca,California,,,,US,True,37.7808729,-121.1864985,America/Los_Angeles,(510) 60*-****,0,OPERATIONAL,FALSE,FALSE,,True,Manteca,California,US,http,http://espressosubito.com,espressosubito.com,espressosubito.com,com,8535,2002-12-03,2026-12-03,"GoDaddy.com, LLC",,,0,0,0,,FALSE,FALSE,5,0,"{""1"": 0, ""2"": 0, ""3"": 0, ""4"": 0, ""5"": 4}",,,,,,,,,,,,,FALSE,TRUE,purchase_dataset@,FALSE,TRUE,0,,,,,,,,,,,,,,,,,,,,,,,,,,,,,,,,,,,,,,,,,,,,,,2026-04-10T19:42:44.349603+00:00,,,,,,,,0.0,0.0,50.0,,,,,,,,,,,,,,,,,,,,,,,,,,,,,,,,,,,,27.9,19.5,0,50,50.0,100.0,159,260,260,85096,161058,161058,701672,1456437,1456437,757113,159,,,,,,,,,,152,163,260,89056,166785,735647,1464979,735647,,,,,,,,,,,,,,,,,,,,,,,,,,,,,,,,,,,,,,,,,,,,,,,,,,,,,,,,,,,,,,,,,,,,,,,,,,,,,,,,,,,,,,,,,,,,,,,,,,,,,,,,,,,,,,,,,,,,,,,,,,,,,,,,,,,,,,,,,,,,,,,,,,,,,,,,,,,,,,,,,,,,,,,,,,,,,,,,,,,,,,,,,,,,,,,,,,,,,,,121,62.6,4.09,364,74.9,0.473,-34.7,,-364,-0.473,0.05,0.9583,0.0,0.0417,0.0333,115,71.52,-71.52,0.0,121,,,,,,,,,,,,,,,,,,,,,1.9,,0,0.0,0.0,,,,,,,,,,,,,,,,,,,,,,,,,,,,,,,,,,,,,,,,,,,,,,,,,,,,,,,,,,,,,,,,
82USRPLL,Applebee's Grill + Bar,Food and Drink,Restaurants,Restaurant,"Restaurant, American restaurant, Bar & grill, Diner, Family restaurant, Hamburger restaurant, Steak house, Traditional American restaurant","1272 E Yosemite Ave, Manteca, CA 95336",1272 E Yosemite Ave,Manteca,California,,,95336,US,True,37.7970706,-121.1967698,America/Los_Angeles,(209) 82*-****,2,,TRUE,TRUE,,True,Manteca,California,US,https,https://restaurants.applebees.com/en-us/ca/manteca/1272-e.-yosemite-ave.-96062,restaurants.applebees.com/en-us/ca/manteca/1272-e.-yosemite-ave.-96062,restaurants.applebees.com,com,11228,1995-07-20,2026-07-19,"MarkMonitor, Inc.",purchase_dataset@applemetro.com,,1,1,0,Full-service chain bar & grill providing hearty American eats in an informal setting.,TRUE,TRUE,3.87,1448,"{""1"": 175, ""2"": 115, ""3"": 272, ""4"": 434, ""5"": 850}","Delivery, Onsite services, Takeout, Dine-in","Fast service, Great beer selection, Great cocktails, Great dessert, Great tea selection, Sports","Lunch, Dinner, Solo dining","Wheelchair accessible entrance, Wheelchair accessible parking lot, Wheelchair accessible restroom, Wheelchair accessible seating","Alcohol, Beer, Cocktails, Coffee, Comfort food, Happy hour drinks, Happy hour food, Hard liquor, Healthy options, Late-night food, Organic dishes, Quick bite, Small plates, Vegetarian options, Wine","Breakfast, Brunch, Lunch, Dinner, Catering, Dessert, Seating, Table service","Bar onsite, Restroom","Casual, Cozy, Trendy","College students, Family-friendly, Groups, LGBTQ+ friendly, Tourists, Transgender safespace",,"Credit cards, Debit cards, NFC mobile payments","Good for kids, Has changing table(s), High chairs, Kids' menu",TRUE,TRUE,purchase_dataset@,TRUE,TRUE,3,2025-08-20,2026-01-23,239,83,24,239,239,83,83,https://www.instagram.com/applebees,applebees,https://www.facebook.com/applebees,applebees,,,,,,,https://www.youtube.com/user/applebeeing,applebeeing,,,,,,,641043,1.32,,0.16,1.42,1.32,2466,,,,,,,,,https://applebees.com/en/menu,,,2026-04-10T11:46:40.647432+00:00,767.72,0.48,0.0,6965.28,273.2,68.2894,0.12,77.4,100.0,68.0,0.3894,,0.1986,0.4597,0.6796,0.2609,0.3908,0.2089,59.9,84.0,,,,62.5,37.5,0.0,80.0,20.0,0.0,85.39,12.92,1.69,stable,declining,,-24.1,-0.481,-28.7,0,8,40,178,-60.0,-82.0,-100.0,72.4,36.8,64,100,65.0,100.0,3,185,3,1225,124724,1554,10238,1074886,12553,10492,3,314451,35,105097,557371,101,619136,591367,101,635360,108,163,260,89056,166785,735647,1464979,735647,0.2033,0.0577,0.37,-0.0577,-0.1714,0.6309,0.0228,0.3085,-0.0228,-0.1099,0.2636,0.12,0.3135,-0.12,-0.1149,100,34,100,314451,377682,105097,0.5713,0.483,0.8584,0.2506,0.2609,64.6,3.97,634,72.6,0.4147,7.8,-0.1,814,-4.6,-0.0253,557371,484608,619136,0.2605,0.3484,0.1829,0.2637,0.3908,65.8,4.12,396,76.9,0.5324,6.6,-0.25,1052,-8.9,-0.143,591367,561598,635360,0.21,Average,0.2438,0.1538,0.2005,0.2089,Below Average,66.6,4.13,387,77.5,Below Average,0.5096,5.8,-0.26,1061,-9.5,-0.1202,35,101,101,280,61,competitive,0.0629,10.82,2.9,20.6,76.5,0.0,2695,1072,competitive,0.0353,1.27,0.0,24.0,74.0,2.0,7950,5071,competitive,0.0361,0.32,0.0,16.0,84.0,0.0,0.0966,0.3794,-0.0966,-0.1808,100,101,49,134,4,0.7293,0.2652,0.9834,0.2928,0.3039,68.9,4.09,574,76.2,0.5138,3.5,-0.22,874,-8.2,-0.1244,competitive,0.0246,1.77,0.0,7.0,91.0,2.0,0.6663,0.12,8.25,0.1191,0.7532,-0.1191,-0.5546,100,101,27238,85381,6547,0.7327,0.1672,0.9364,0.2145,0.2676,82.2,4.77,1876,95.1,0.8581,-9.8,-0.9,-428,-27.1,-0.4687,competitive,0.0077,0.0002,1.28,0.02,0.6241,0.08,0.3009,-0.08,-0.1023,793989,61.4,3.79,385,76.0,0.4601,11.0,0.08,1063,-0.0707,0.7571,0.2079,0.9868,0.2822,0.3697,190309,0.6612,-8.0,626130,10477,25.1,59.3,4.4,11.2,793990,121,62.6,4.09,364,74.9,0.473,9.8,-0.22,1084,-0.0836,0.8,0.2167,1.0,0.2667,0.3,24,71.52,5.4,0.3917,121,11.98,835,1479,0.6875,6874.54,0.03,395382,93,0.0047,47.46,39.6,285.71,12.45,99.01,13.01,99.01,6.05,99.01,0.59,99.01,0.2,0.0,-5,0.1,0.0,,,,,,-0.01,32626,-0.039,-71.57,246425,-0.333,0.03,-9363,0.022,-71.94,488542,-0.644,0.03,-4983,0.016,-72.0,522833,-0.694,-0.02,6,-0.033,-71.63,-74495,-0.177,-0.01,-941,0.014,-71.68,-47510,-0.174,0.3894,,,1448,0.13,4.0,0.857,0.913,decelerating,0.13,0.93,4.00,4,16,190,0.887,0.890,0.890,0.857,0.913,76086,79474,79376,3,645,decelerating,0.00,,76.92
